{"blocks_dot_json_patches":{"grass_block":"grass","trip_wire":"tripWire","sea_lantern":"seaLantern","iron_chain":"chain","unknown":"info_update"},"blocks_to_use_carried_textures":["acacia_leaves","birch_leaves","bush","dark_oak_leaves","fern","firefly_bush","leaves","leaves2","mangrove_leaves","oak_leaves","open_eyeblossom","short_grass","spruce_leaves","vine","waterlily"],"transparent_blocks":{"water":0.65,"flowing_water":0.65,"slime":0.8,"respawn_anchor":2},"terrain_texture_tints":{"colors":{"foliage":"#79C05A","water":"#44AFF5"},"terrain_texture_keys":{"grass_top":"foliage","tall_grass_bottom":{"tint":"foliage","tint_like_png":true},"tall_grass_top":{"tint":"foliage","tint_like_png":true},"large_fern_bottom":{"tint":"foliage","tint_like_png":true},"large_fern_top":{"tint":"foliage","tint_like_png":true},"reeds":{"tint":"foliage","tint_like_png":true},"jungle_leaves":{"tint":"#57BE08","tint_like_png":true},"leaf_litter":"#A36D46","flowing_water_grey":"water","flowing_water":"water","still_water_grey":"water","still_water":"water"}},"missing_flipbook_textures":[],"$schema":"schemas/textureAtlasMappings.schema.json"}